{
  "dependencies": [
    {
      "architecture": "aarch64",
      "namespace": "linux",
      "provider": "portmaster",
      "soname": "libSDL2-2.0.so.0"
    },
    {
      "architecture": "aarch64",
      "namespace": "linux",
      "provider": "glibc-base",
      "soname": "libc.so.6"
    },
    {
      "architecture": "aarch64",
      "namespace": "linux",
      "provider": "glibc-base",
      "soname": "libdl.so.2"
    },
    {
      "architecture": "aarch64",
      "namespace": "linux",
      "provider": "firmware",
      "soname": "libgcc_s.so.1"
    },
    {
      "architecture": "aarch64",
      "namespace": "linux",
      "provider": "glibc-base",
      "soname": "libm.so.6"
    },
    {
      "architecture": "aarch64",
      "namespace": "linux",
      "provider": "glibc-base",
      "soname": "libpthread.so.0"
    }
  ],
  "exceptions": [],
  "files": [
    {
      "kind": "launcher",
      "mode": "0755",
      "sha256": "ab7b6420d91f2a8f7aa42b909282d5d472de79c67ac5e167ac31103581b78a29",
      "source": "Oceanhorn Chronos Dungeon.sh",
      "target": "Oceanhorn Chronos Dungeon.sh"
    },
    {
      "kind": "nxbootstrap-config",
      "mode": "0644",
      "sha256": "e3acb6204da16b28ff01633d55254158f3d7589f16edcff495cea8dc1f8be3e3",
      "source": "nxport.json",
      "target": "oceanhorn/nxport.json"
    },
    {
      "kind": "payload",
      "mode": "0644",
      "sha256": "10a85074082bb4ab60dd3b319a6dede03bedb399465999ba97f37fd65b62c478",
      "source": "nxproject.json",
      "target": "oceanhorn/nxproject.json"
    },
    {
      "architecture": "aarch64",
      "build_profile": "universal-low-glibc",
      "kind": "project-linux",
      "mode": "0755",
      "needed": [
        "libSDL2-2.0.so.0",
        "libc.so.6",
        "libdl.so.2",
        "libgcc_s.so.1",
        "libm.so.6",
        "libpthread.so.0"
      ],
      "provenance": "port build script; framework pinned by FRAMEWORK-PIN.json",
      "sha256": "8a3544c7296e770f388592b79023ed71c8aa2c4ef2de31a39859d0fab8408fbc",
      "soname": null,
      "source": "oceanhorn-nextos",
      "target": "oceanhorn/oceanhorn-nextos"
    },
    {
      "kind": "payload",
      "mode": "0644",
      "sha256": "e4d81319bf7384934ed1edad1dfc4c32761fc2f9fa64a8ee592cdff01f5d6b30",
      "source": "README.md",
      "target": "oceanhorn/README.md"
    },
    {
      "kind": "payload",
      "mode": "0644",
      "sha256": "a1447204af67995b92f7ee73bc0b5e6a0f01bcaaad1f133044983d11abbf91c8",
      "source": "INSTALLATION.md",
      "target": "oceanhorn/INSTALLATION.md"
    },
    {
      "kind": "license-notice",
      "mode": "0644",
      "sha256": "27f055d4954a0c97aec8bb455c0d6b20c54f60d53c885aef36f86b5793ecd87a",
      "source": "LICENSE",
      "target": "oceanhorn/LICENSE"
    },
    {
      "kind": "portmaster-metadata",
      "mode": "0644",
      "sha256": "9bf7fafa19df24fa96bca256ceb34fa2f8ca2b8300cc82dff7c4e9a62b20258a",
      "source": "port.json",
      "target": "oceanhorn/port.json"
    },
    {
      "kind": "portmaster-metadata",
      "mode": "0644",
      "sha256": "eebb92ad52a6b00558f37331bf537c4dc84ea75f4580f9bc4140ed5d0b3efa46",
      "source": "gameinfo.xml",
      "target": "oceanhorn/gameinfo.xml"
    },
    {
      "architecture": "aarch64",
      "build_profile": "universal-low-glibc",
      "kind": "nxsplash-linux",
      "mode": "0755",
      "needed": [
        "libc.so.6",
        "libdl.so.2"
      ],
      "provenance": "NXSplash 0.1.2 canonical aarch64 artifact",
      "sha256": "d85d896a906a778c9af250e5617d45d085a98b18552cb0254addbbc626036c97",
      "soname": null,
      "source": "nxsplash-nextos",
      "target": "oceanhorn/nxsplash-nextos"
    },
    {
      "kind": "license-notice",
      "mode": "0644",
      "sha256": "a4848456dc47d86190d3028e865e8dc7670b5a668ade10e80439188fbe385f04",
      "source": "NOTICE.md",
      "target": "oceanhorn/NOTICE.md"
    },
    {
      "kind": "payload",
      "mode": "0644",
      "sha256": "fe840f52fb5578d3f77eb497115eb02c6036601c3a53e60df7995c7276baa77a",
      "source": "version.txt",
      "target": "oceanhorn/version.txt"
    },
    {
      "kind": "payload",
      "mode": "0644",
      "sha256": "11a14045afe1414439506021f382e3e5a2d2e923b8cd99a68b01c169072c1b7b",
      "source": "FRAMEWORK-PIN.json",
      "target": "oceanhorn/FRAMEWORK-PIN.json"
    },
    {
      "kind": "payload",
      "mode": "0644",
      "sha256": "ea03560b6240b9c90dede433ce52c9e36cd2ed04e9fca650699f27499b0c4c8c",
      "source": "port-env.sh",
      "target": "oceanhorn/port-env.sh"
    },
    {
      "kind": "payload",
      "mode": "0644",
      "sha256": "dbd60853647966ce94c7df14edcd43d40faa1467ee4efbcaa13d973fa664a4a2",
      "source": "adapter/adapter-contract.json",
      "target": "oceanhorn/adapter/adapter-contract.json"
    },
    {
      "kind": "payload",
      "mode": "0644",
      "sha256": "ff398cd8f93b945e5330ca1a78da8afadcd8e11f3f47738f25194ef5c5ca6099",
      "source": "gamedata/README.txt",
      "target": "oceanhorn/gamedata/README.txt"
    },
    {
      "kind": "license-notice",
      "mode": "0644",
      "sha256": "74d7d9d40e27fbfe23cb462f9608fa07cbe53ffb0b88a0da9e85dda240c2c788",
      "source": "licenses/NXExtract-MIT.txt",
      "target": "oceanhorn/licenses/NXExtract-MIT.txt"
    },
    {
      "kind": "nxextract-recipe",
      "mode": "0644",
      "sha256": "5134aee6a38a22feb1e2cfcb954fd44859d1f5458c53cf3c40fda14b00c2e1e0",
      "source": "extractor.json",
      "target": "oceanhorn/extractor.json"
    },
    {
      "kind": "nxextract",
      "mode": "0644",
      "sha256": "0243b65874a58e71b156c049812c34906fcc44f7c0fdea1a9322bd132183779f",
      "source": "nxextract/nxextract.py",
      "target": "oceanhorn/nxextract/nxextract.py"
    },
    {
      "kind": "nxextract-runner",
      "mode": "0644",
      "sha256": "c931427c7226d22d7e30eee8549b50f0621dca1c9d0336634aca08631f454d7a",
      "source": "nxextract/run-extractor.sh",
      "target": "oceanhorn/nxextract/run-extractor.sh"
    },
    {
      "kind": "nxextract-runtime-env",
      "mode": "0644",
      "sha256": "332919a9960d4317563b647f9932d1a4367da147a425fe2f78eafd706f01563f",
      "source": "nxextract/nxextract-runtime-env.sh",
      "target": "oceanhorn/nxextract/nxextract-runtime-env.sh"
    },
    {
      "architecture": "aarch64",
      "build_profile": "universal-low-glibc",
      "kind": "nxextract-ui-linux",
      "mode": "0755",
      "needed": [
        "libc.so.6",
        "libdl.so.2"
      ],
      "provenance": "NXExtract UI 1.2.18 canonical aarch64 artifact",
      "sha256": "8e4a68ae0a611096d23b04628b4f2e8b5cf34755fe9b71d134bc0d7ea6ccf987",
      "soname": null,
      "source": "nxextract/nxextract-ui",
      "target": "oceanhorn/nxextract/nxextract-ui"
    },
    {
      "kind": "payload",
      "mode": "0644",
      "sha256": "1046822942b68dbf8a31e81e25f587c411ec42cfa7b13498b2df79723e8b248a",
      "source": "nxextract-version.txt",
      "target": "oceanhorn/nxextract-version.txt"
    }
  ],
  "nxextract": {
    "minimum_version": "1.2.18",
    "path": "oceanhorn/nxextract/nxextract.py",
    "recipe_path": "oceanhorn/extractor.json",
    "recipe_sha256": "5134aee6a38a22feb1e2cfcb954fd44859d1f5458c53cf3c40fda14b00c2e1e0",
    "runner_path": "oceanhorn/nxextract/run-extractor.sh",
    "runner_sha256": "c931427c7226d22d7e30eee8549b50f0621dca1c9d0336634aca08631f454d7a",
    "runtime_env_path": "oceanhorn/nxextract/nxextract-runtime-env.sh",
    "runtime_env_sha256": "332919a9960d4317563b647f9932d1a4367da147a425fe2f78eafd706f01563f",
    "sha256": "0243b65874a58e71b156c049812c34906fcc44f7c0fdea1a9322bd132183779f",
    "ui_path": "oceanhorn/nxextract/nxextract-ui",
    "ui_sha256": "8e4a68ae0a611096d23b04628b4f2e8b5cf34755fe9b71d134bc0d7ea6ccf987",
    "version": "1.2.18"
  },
  "package": {
    "id": "oceanhorn",
    "launcher": "Oceanhorn Chronos Dungeon.sh",
    "launcher_chain": [
      "Oceanhorn Chronos Dungeon.sh"
    ],
    "launcher_contract": {
      "config_path": "oceanhorn/nxport.json",
      "config_sha256": "e3acb6204da16b28ff01633d55254158f3d7589f16edcff495cea8dc1f8be3e3",
      "generator": "nxbootstrap",
      "version": "0.6.30"
    },
    "license": {
      "file": "oceanhorn/LICENSE",
      "source_url": "https://github.com/NextOs-Ports/oceanhorn-nextos",
      "spdx_id": "GPL-3.0-only"
    },
    "port_dir": "oceanhorn",
    "profile": "universal-portmaster",
    "version": "2.0.1"
  },
  "portmaster_metadata": {
    "gameinfo_xml": {
      "path": "oceanhorn/gameinfo.xml",
      "sha256": "eebb92ad52a6b00558f37331bf537c4dc84ea75f4580f9bc4140ed5d0b3efa46"
    },
    "images": [],
    "port_json": {
      "path": "oceanhorn/port.json",
      "sha256": "9bf7fafa19df24fa96bca256ceb34fa2f8ca2b8300cc82dff7c4e9a62b20258a"
    }
  },
  "release": {
    "compression": "deflated",
    "max_glibc": "2.30",
    "source_date_epoch": 1786492800
  },
  "schema_version": 2,
  "source_root": "."
}
