{
  "dependencies": [
    {
      "architecture": "aarch64",
      "namespace": "linux",
      "path": "beachbuggy/lib/libSDL3.so.0",
      "provider": "package",
      "soname": "libSDL3.so.0"
    },
    {
      "architecture": "aarch64",
      "namespace": "linux",
      "provider": "glibc-base",
      "soname": "libc.so.6"
    },
    {
      "architecture": "aarch64",
      "namespace": "linux",
      "provider": "glibc-base",
      "soname": "libdl.so.2"
    },
    {
      "architecture": "aarch64",
      "namespace": "linux",
      "provider": "glibc-base",
      "soname": "libm.so.6"
    },
    {
      "architecture": "aarch64",
      "namespace": "linux",
      "provider": "glibc-base",
      "soname": "libpthread.so.0"
    },
    {
      "architecture": "aarch64",
      "namespace": "linux",
      "provider": "firmware",
      "soname": "libz.so.1"
    }
  ],
  "exceptions": [],
  "files": [
    {
      "kind": "launcher",
      "mode": "0755",
      "sha256": "65a298f0d882361b36f719afa16841b44edc88084e995240ad186f241cf744e9",
      "source": "Beach Buggy Racing.sh",
      "target": "Beach Buggy Racing.sh"
    },
    {
      "kind": "nxbootstrap-config",
      "mode": "0644",
      "sha256": "8e061b99d5c6f9471c41808b042f7296f35838194819a6a955421856135c6224",
      "source": "nxport.json",
      "target": "beachbuggy/nxport.json"
    },
    {
      "kind": "payload",
      "mode": "0644",
      "sha256": "ef84fdb87aefc1ff5ed5eddbde43cd32f8fac0db0971afdf37c5619272b2fd59",
      "source": "nxproject.json",
      "target": "beachbuggy/nxproject.json"
    },
    {
      "architecture": "aarch64",
      "build_profile": "universal-low-glibc",
      "kind": "project-linux",
      "mode": "0755",
      "needed": [
        "libSDL3.so.0",
        "libc.so.6",
        "libdl.so.2",
        "libm.so.6",
        "libpthread.so.0",
        "libz.so.1"
      ],
      "provenance": "port build script; framework pinned by FRAMEWORK-PIN.json",
      "sha256": "5ea57369beaf35ef42aaecfc44d728642bc30abdc760894c4eb8101ff7656a47",
      "soname": null,
      "source": "beachbuggy",
      "target": "beachbuggy/beachbuggy"
    },
    {
      "kind": "payload",
      "mode": "0644",
      "sha256": "256c1681f8b5ddce6479a8543b96b995880fdc4c93642927477ebd7d064d90bb",
      "source": "README.md",
      "target": "beachbuggy/README.md"
    },
    {
      "kind": "payload",
      "mode": "0644",
      "sha256": "16a29abc9625f26863cbf95bef8b03c2fa51dc400c0674b036e5758f566f180d",
      "source": "INSTALLATION.md",
      "target": "beachbuggy/INSTALLATION.md"
    },
    {
      "kind": "license-notice",
      "mode": "0644",
      "sha256": "fb981668c18a279e285fc4d83fba1e836cc84dd4daa73c9697d3cfd2d8aca6e0",
      "source": "LICENSE",
      "target": "beachbuggy/LICENSE"
    },
    {
      "kind": "portmaster-metadata",
      "mode": "0644",
      "sha256": "29448da9bbabd94b3c4e5b43eb1c1bedc7508e57b0374ceed28935b099c13cf8",
      "source": "port.json",
      "target": "beachbuggy/port.json"
    },
    {
      "kind": "portmaster-metadata",
      "mode": "0644",
      "sha256": "6639b8a64c402c1281fc79a3d87a32429a4cb718a56e396bebe35a33439fb59b",
      "source": "gameinfo.xml",
      "target": "beachbuggy/gameinfo.xml"
    },
    {
      "architecture": "aarch64",
      "build_profile": "universal-low-glibc",
      "kind": "nxsplash-linux",
      "mode": "0755",
      "needed": [
        "libc.so.6",
        "libdl.so.2"
      ],
      "provenance": "NXSplash 0.1.2 canonical aarch64 artifact",
      "sha256": "d85d896a906a778c9af250e5617d45d085a98b18552cb0254addbbc626036c97",
      "soname": null,
      "source": "nxsplash-nextos",
      "target": "beachbuggy/nxsplash-nextos"
    },
    {
      "kind": "payload",
      "mode": "0644",
      "sha256": "44e161e4495cac2cf7858043e9e6418e9579f0ddcfae826f9a372622968ce066",
      "source": "version.txt",
      "target": "beachbuggy/version.txt"
    },
    {
      "architecture": "aarch64",
      "build_profile": "universal-low-glibc",
      "kind": "third-party-linux",
      "mode": "0755",
      "needed": [
        "libc.so.6",
        "libdl.so.2",
        "libm.so.6",
        "libpthread.so.0"
      ],
      "provenance": "bundled runtime dependency",
      "sha256": "dd830926f57401042bc62d6e6462736f68866c84deba2074d1fff40ad5747c46",
      "soname": "libSDL3.so.0",
      "source": "lib/libSDL3.so.0",
      "target": "beachbuggy/lib/libSDL3.so.0"
    },
    {
      "kind": "nxextract-recipe",
      "mode": "0644",
      "sha256": "55f9040a2587f8b4e05a82545de47f8d30afd57860956c0b1171c5a70ff52b86",
      "source": "extractor.json",
      "target": "beachbuggy/extractor.json"
    },
    {
      "kind": "nxextract",
      "mode": "0644",
      "sha256": "0243b65874a58e71b156c049812c34906fcc44f7c0fdea1a9322bd132183779f",
      "source": "nxextract/nxextract.py",
      "target": "beachbuggy/nxextract/nxextract.py"
    },
    {
      "kind": "nxextract-runner",
      "mode": "0644",
      "sha256": "c931427c7226d22d7e30eee8549b50f0621dca1c9d0336634aca08631f454d7a",
      "source": "nxextract/run-extractor.sh",
      "target": "beachbuggy/nxextract/run-extractor.sh"
    },
    {
      "kind": "nxextract-runtime-env",
      "mode": "0644",
      "sha256": "332919a9960d4317563b647f9932d1a4367da147a425fe2f78eafd706f01563f",
      "source": "nxextract/nxextract-runtime-env.sh",
      "target": "beachbuggy/nxextract/nxextract-runtime-env.sh"
    },
    {
      "architecture": "aarch64",
      "build_profile": "universal-low-glibc",
      "kind": "nxextract-ui-linux",
      "mode": "0755",
      "needed": [
        "libc.so.6",
        "libdl.so.2"
      ],
      "provenance": "NXExtract UI 1.2.18 canonical aarch64 artifact",
      "sha256": "8e4a68ae0a611096d23b04628b4f2e8b5cf34755fe9b71d134bc0d7ea6ccf987",
      "soname": null,
      "source": "nxextract/nxextract-ui",
      "target": "beachbuggy/nxextract/nxextract-ui"
    },
    {
      "kind": "payload",
      "mode": "0644",
      "sha256": "1046822942b68dbf8a31e81e25f587c411ec42cfa7b13498b2df79723e8b248a",
      "source": "nxextract-version.txt",
      "target": "beachbuggy/nxextract-version.txt"
    }
  ],
  "nxextract": {
    "minimum_version": "1.2.18",
    "path": "beachbuggy/nxextract/nxextract.py",
    "recipe_path": "beachbuggy/extractor.json",
    "recipe_sha256": "55f9040a2587f8b4e05a82545de47f8d30afd57860956c0b1171c5a70ff52b86",
    "runner_path": "beachbuggy/nxextract/run-extractor.sh",
    "runner_sha256": "c931427c7226d22d7e30eee8549b50f0621dca1c9d0336634aca08631f454d7a",
    "runtime_env_path": "beachbuggy/nxextract/nxextract-runtime-env.sh",
    "runtime_env_sha256": "332919a9960d4317563b647f9932d1a4367da147a425fe2f78eafd706f01563f",
    "sha256": "0243b65874a58e71b156c049812c34906fcc44f7c0fdea1a9322bd132183779f",
    "ui_path": "beachbuggy/nxextract/nxextract-ui",
    "ui_sha256": "8e4a68ae0a611096d23b04628b4f2e8b5cf34755fe9b71d134bc0d7ea6ccf987",
    "version": "1.2.18"
  },
  "package": {
    "id": "beachbuggy",
    "launcher": "Beach Buggy Racing.sh",
    "launcher_chain": [
      "Beach Buggy Racing.sh"
    ],
    "launcher_contract": {
      "config_path": "beachbuggy/nxport.json",
      "config_sha256": "8e061b99d5c6f9471c41808b042f7296f35838194819a6a955421856135c6224",
      "generator": "nxbootstrap",
      "version": "0.6.30"
    },
    "license": {
      "file": "beachbuggy/LICENSE",
      "source_url": "https://github.com/NextOs-Ports/nextos_ports_android",
      "spdx_id": "GPL-3.0-only"
    },
    "port_dir": "beachbuggy",
    "profile": "universal-portmaster",
    "version": "1.0.1"
  },
  "portmaster_metadata": {
    "gameinfo_xml": {
      "path": "beachbuggy/gameinfo.xml",
      "sha256": "6639b8a64c402c1281fc79a3d87a32429a4cb718a56e396bebe35a33439fb59b"
    },
    "images": [],
    "port_json": {
      "path": "beachbuggy/port.json",
      "sha256": "29448da9bbabd94b3c4e5b43eb1c1bedc7508e57b0374ceed28935b099c13cf8"
    }
  },
  "release": {
    "compression": "deflated",
    "max_glibc": "2.30",
    "source_date_epoch": 1786492800
  },
  "schema_version": 2,
  "source_root": "."
}
